{
  "artifacts": [],
  "captured_at": "2026-05-27T00:00:00.000Z",
  "cell_states": [],
  "data_validations": [],
  "formula_samples": [],
  "locale": "en_US",
  "named_ranges": [
    {
      "name": "Inputs",
      "range": {
        "range": "A1:B10",
        "sheet_id": 10
      }
    }
  ],
  "protected_ranges": [
    {
      "protected_range_id": 3,
      "range": {
        "range": "A1:B1",
        "sheet_id": 10
      },
      "warning_only": true
    }
  ],
  "schema_version": "1.0",
  "snapshot_id": "snapshot-1",
  "spreadsheet_id": "spreadsheet-1",
  "tabs": [
    {
      "column_count": 20,
      "hidden": false,
      "index": 0,
      "row_count": 100,
      "sheet_id": 10,
      "title": "Input"
    }
  ],
  "telemetry": {
    "elapsed_ms": 42,
    "request_count": 1,
    "retry_count": 0,
    "timeout_budget": {
      "poll_seconds": 120,
      "read_seconds": 60,
      "write_seconds": 60
    }
  },
  "time_zone": "Asia/Seoul",
  "title": "Ops Sheet"
}
